{
  "id": "exemple_complet",
  "patient": {
    "nom": "Durand",
    "prenom": "Marie",
    "age": 45,
    "sexe": "F",
    "taille": "160 cm",
    "poids": "65 kg",
    "groupeSanguin": "B+"
  },
  "interrogatoire": {
    "motifHospitalisation": "Douleur abdominale aiguë",
    "modeDeVie": {
      "activitePhysique": { "description": "Modérée (marche 30 min/jour)" },
      "tabac": { "quantite": "0 PA", "duree": "Jamais" },
      "alcool": { "quantite": "Sociale (1 verre/semaine)" },
      "alimentation": { "regime": "Équilibré", "particularites": "Végétarienne" },
      "emploi": { "profession": "Enseignante", "stress": "Modéré" }
    },
    "antecedents": {
      "medicaux": [{ "type": "Migraines", "traitement": "Paracétamol" }],
      "chirurgicaux": [{ "intervention": "Cholécystectomie", "date": "2010" }],
      "familiaux": [{ "lien": "Mère", "pathologie": "Diabète type 2", "age": "60" }]
    },
    "traitements": [{ "nom": "Pilule contraceptive", "dose": "1/j", "frequence": "Quotidien" }],
    "allergies": { "presence": true, "liste": [{ "allergene": "Pénicilline", "reaction": "Éruption cutanée" }] },
    "histoireMaladie": {
      "debutSymptomes": "Hier soir",
      "evolution": "Brutale, s'aggravant",
      "facteursDeclenchants": "Repas riche",
      "symptomesAssocies": ["Nausées", "Vomissements", "Fièvre légère"],
      "remarques": "Douleur localisée en hypochondre droit"
    }
  },
  "examenClinique": {
    "constantes": {
      "tension": "110/70 mmHg",
      "pouls": "95 bpm",
      "temperature": "38.2°C",
      "saturationO2": "98%",
      "frequenceRespiratoire": "18/min"
    },
    "aspectGeneral": "Fatiguée, algique",
    "examenCardiovasculaire": { "auscultation": "Rythme régulier, pas de souffle" },
    "examenPulmonaire": { "auscultation": "Murmure vésiculaire normal" },
    "examenAbdominal": { "palpation": "Douleur à la palpation de l'hypochondre droit, défense" },
    "examenNeurologique": { "conscience": "Normale" }
  },
  "availableExams": ["NFS", "Ionogramme", "Bilan hépatique", "CRP", "Échographie abdominale", "Scanner abdominal"],
  "examResults": {
    "NFS": "Hyperleucocytose à PNN",
    "Ionogramme": "Normal",
    "Bilan hépatique": "Élévation des transaminases et de la bilirubine",
    "CRP": "Élevée",
    "Échographie abdominale": "Calculs vésiculaires, épaississement de la paroi vésiculaire",
    "Scanner abdominal": "Confirme les signes d'inflammation vésiculaire, pas de perforation"
  },
  "possibleDiagnostics": ["Cholécystite aiguë", "Pancréatite aiguë", "Appendicite aiguë", "Colique hépatique"],
  "correctDiagnostic": "Cholécystite aiguë",
  "feedback": {
    "Cholécystite aiguë": "Diagnostic correct !",
    "default": "Diagnostic incorrect."
  },
  "scoringRules": { "baseScore": 120, "attemptPenalty": 15 },
  "possibleTreatments": ["Antalgiques", "Antibiotiques", "Jeûne", "Chirurgie (cholécystectomie)", "Hydratation IV"],
  "correctTreatments": ["Antalgiques", "Antibiotiques", "Jeûne", "Hydratation IV", "Chirurgie (cholécystectomie)"],
  "correction": "<h3>Cholécystite aiguë</h3><p>Douleur HCD post‑repas riche, fièvre légère, signes inflammatoires et écho évocatrice.</p><h4>Bonnes pratiques</h4><ul><li>Échographie en première intention</li><li>Antalgiques, antibiothérapie, jeûne et hydratation IV</li><li>Cholécystectomie dans les 72 h si non compliquée</li></ul><h4>Erreurs à éviter</h4><ul><li>Ignorer un antécédent de cholécystectomie (rend le diagnostic incohérent)</li><li>Retarder l’antibiothérapie en cas de suspicion infectieuse</li></ul>"
}
